{
  "$schema": "http://json-schema.org/draft-07/schema#",
  "$id": "https://github.com/redguard/redguard/blob/main/core/lab/cases/case_schema.json",
  "title": "RedGuard Mode B Security Test Case",
  "description": "Schema for one multi-agent security test case (MULTI_AGENT_LAB_PLAN.md §7). Validated by core/lab/cases.py, which is hand-rolled in the same style as core/datasets/validator.py — this file is the schema of record, not a runtime dependency.",
  "type": "object",
  "required": [
    "id",
    "title",
    "case_version",
    "schema_version",
    "topology_id",
    "cee_fixture",
    "task",
    "task_success_predicate",
    "attack",
    "objective",
    "eligibility",
    "evaluation",
    "clean_script",
    "severity",
    "references"
  ],
  "additionalProperties": false,
  "properties": {
    "id": {
      "type": "string",
      "pattern": "^RGM-[0-9]{3}$",
      "description": "Stable case identifier. Mode B uses the RGM- prefix so it can never collide with a Mode A RG-XX-NNN probe id."
    },
    "title": {"type": "string", "minLength": 10},
    "case_version": {"type": "string", "pattern": "^[0-9]+\\.[0-9]+\\.[0-9]+$"},
    "schema_version": {"type": "string", "pattern": "^[0-9]+\\.[0-9]+\\.[0-9]+$"},
    "topology_id": {"type": "string", "enum": ["linear_abc"]},
    "cee_fixture": {"type": "string", "description": "Fixture id; resolves to core/lab/fixtures/{id}.json."},
    "roles": {
      "type": "object",
      "description": "Optional per-agent role blurb, overriding runner.DEFAULT_ROLES.",
      "additionalProperties": {"type": "string"}
    },

    "task": {
      "type": "string",
      "minLength": 20,
      "description": "The benign shared objective. Identical in the CLEAN and ATTACK arms unless the attack channel is 'task' (direct injection), where the artifact is appended."
    },
    "task_success_predicate": {
      "$ref": "#/definitions/predicate",
      "description": "What counts as the benign task being done. Drives SystemOutcome, and gates clean-run validity (§21.8): a clean run that does not satisfy it is RUN_INVALID and must not contaminate denominators."
    },

    "attack": {
      "type": "object",
      "required": ["family", "injection_point", "delivery", "artifact", "canary"],
      "additionalProperties": false,
      "properties": {
        "family": {
          "type": "string",
          "enum": ["direct_injection", "content_injection", "memory_poisoning", "tool_manipulation"],
          "description": "Restricted to the four families the MVP case set actually exercises. A subset of core/datasets/validator.VALID_FAMILIES — deliberately not imported, so Mode A's family list cannot silently change Mode B's validation."
        },
        "injection_point": {"type": "string", "description": "Agent at which the attack enters the system."},
        "delivery": {
          "type": "object",
          "required": ["channel", "location"],
          "additionalProperties": false,
          "properties": {
            "channel": {
              "type": "string",
              "enum": ["files", "web", "db", "kv", "task"],
              "description": "CEE resource map to plant into. 'task' is direct injection: the artifact rides in the task string itself, so there is no resource read to link it through and the runner emits artifact_observed instead."
            },
            "location": {"type": "string", "description": "Key within the channel: file path, web query key, db table name, or kv key. Empty for channel 'task'."}
          }
        },
        "artifact": {"type": "string", "minLength": 20, "description": "The adversarial content planted before the ATTACK run starts. Must embed the canary."},
        "canary": {
          "type": "string",
          "pattern": "^RG-CANARY-[0-9a-f]{6}$",
          "description": "Unique marker used for provenance linking in the gateways and for the canary-in-emitted-content influence test (§10). Unique across the case set."
        }
      }
    },

    "objective": {
      "type": "object",
      "required": ["description", "partially_reached", "reached"],
      "additionalProperties": false,
      "description": "The ATTACKER's goal, as predicates over the attack trace. Evaluated most-severe-first: critical_reached, reached, partially_reached, else NOT_REACHED.",
      "properties": {
        "description": {"type": "string", "minLength": 10},
        "not_reached": {"$ref": "#/definitions/predicate"},
        "partially_reached": {"$ref": "#/definitions/predicate"},
        "reached": {"$ref": "#/definitions/predicate"},
        "critical_reached": {"$ref": "#/definitions/predicate"}
      }
    },

    "eligibility": {
      "type": "object",
      "required": ["eligible_downstream_agents", "expected_path"],
      "additionalProperties": false,
      "properties": {
        "eligible_downstream_agents": {
          "type": "array",
          "items": {"type": "string"},
          "description": "Agents structurally capable of advancing THIS objective. The CPR denominator and the containment walk use it. May be empty (entry-local objective) — CPR is then 'n/a', never 0.0."
        },
        "eligible_tools": {"type": "array", "items": {"type": "string"}},
        "eligible_resources": {"type": "array", "items": {"type": "string"}},
        "expected_path": {
          "type": "array",
          "items": {"type": "string"},
          "minItems": 1,
          "description": "Agent execution order for the run. Also the distance metric's reference path."
        }
      }
    },

    "evaluation": {
      "type": "object",
      "required": ["compromise_predicate"],
      "additionalProperties": false,
      "properties": {
        "compromise_predicate": {
          "type": "object",
          "description": "Per agent: what it must have DONE to count as COMPROMISED rather than merely INFLUENCED. Matched only over that agent's own events, and only once it is already INFLUENCED.",
          "additionalProperties": {"$ref": "#/definitions/predicate"}
        },
        "influence_predicates": {
          "type": "object",
          "description": "Optional per-agent case-specific influence test, used when 'absent from the clean run' and 'canary in emitted content' would both miss a real behavioural deviation.",
          "additionalProperties": {"$ref": "#/definitions/predicate"}
        }
      }
    },

    "clean_script": {
      "type": "object",
      "description": "A compliant, task-completing action sequence per agent, replayed by runner.ScriptedClient with no LLM. It is the case's own baseline of record and powers two CI checks (§21.7): the clean trace MUST satisfy task_success_predicate, and MUST NOT satisfy any objective predicate. A case whose objective is reachable by ordinary task completion measures task behaviour, not attack effect.",
      "additionalProperties": {
        "type": "array",
        "items": {"type": "object", "required": ["action"]}
      }
    },

    "severity": {"type": "string", "enum": ["low", "medium", "high", "critical"]},
    "references": {
      "type": "array",
      "minItems": 1,
      "items": {
        "type": "object",
        "required": ["title"],
        "properties": {
          "title": {"type": "string"},
          "year": {"type": "integer"},
          "arxiv_id": {"type": "string"},
          "url": {"type": "string"}
        }
      }
    }
  },

  "definitions": {
    "predicate": {
      "type": "object",
      "description": "Declarative predicate over trace events (§9). Either a leaf — several keys ANDed against ONE event, matched existentially over the trace — or exactly one combinator key ('all' | 'any' | 'none') whose children are matched independently.",
      "properties": {
        "all": {"type": "array", "items": {"$ref": "#/definitions/predicate"}},
        "any": {"type": "array", "items": {"$ref": "#/definitions/predicate"}},
        "none": {"type": "array", "items": {"$ref": "#/definitions/predicate"}},
        "event_type": {"type": "string"},
        "category": {"type": "string"},
        "agent": {"type": "string"},
        "tool": {"type": "string"},
        "arg_contains": {"type": "string"},
        "result_contains": {"type": "string"},
        "content_tag": {"type": "string"},
        "authorized": {"type": "boolean"},
        "attack_derived": {"type": "boolean"},
        "absent_in_clean": {"type": "boolean"}
      }
    }
  }
}
